{
    "schemaVersion": 1,
    "chainId": 1,
    "network": "ethereum",
    "deployments": [
        {
            "id": "ethereum-fusion-factory-cd05909c",
            "chainId": 1,
            "kind": "fusion-factory",
            "status": "candidate",
            "address": "0xcd05909C4A1F8E501e4ED554cEF4Ed5E48D9b852",
            "proxy": {
                "type": "erc1967",
                "implementation": "0xf19C1E9f6616F6056AF1e322A86fDaAaAf0263f5",
                "implementationSlot": "0x360894a13ba1a3210667c828492db98dca3e2076cc3735a920a3ca505d382bbc"
            },
            "provenance": {
                "addressSource": {
                    "kind": "fusion-address-lookup",
                    "reference": "agent-readiness/tasks/T20/address-lookup.json",
                    "capturedAt": "2026-09-09"
                },
                "deploymentTransaction": null,
                "deploymentBlock": null,
                "explorerUrl": "https://etherscan.io/address/0xcd05909C4A1F8E501e4ED554cEF4Ed5E48D9b852",
                "confirmedBy": "IPOR Fusion SDK fusion_address_lookup 3.6.7"
            },
            "code": {
                "proxyRuntimeCodeHash": null,
                "implementationRuntimeCodeHash": null,
                "sourceCommit": null,
                "compiler": {
                    "version": "v0.8.30+commit.73712a01",
                    "optimizerEnabled": true,
                    "optimizerRuns": 200,
                    "evmVersion": "cancun",
                    "libraries": {}
                }
            },
            "interface": {
                "abiPath": "abi/fusion-factory-ethereum-0xf19c1e9f6616f6056af1e322a86fdaaaaf0263f5/FusionFactory.abi.json",
                "abiSha256": "6d2da724f6c057439455b6a01cbc153c4b6e076cc72f6f7ef1b12ebd202c019f",
                "adapter": null,
                "reportedVersion": null,
                "supportedOperations": ["clone(string,string,address,uint256,address,uint256)"]
            },
            "dependencies": [],
            "verification": {
                "blockNumber": null,
                "blockHash": null,
                "checkedAt": null,
                "inspectorVersion": null,
                "reportPath": null,
                "compatibilityTestPath": null
            }
        }
    ]
}
